"dataset_id","field_checked","old_value","verified_value","evidence_url","decision","notes"
"DS001","accession/publication/population/sample counts","GSE111889; phs001559; Adult; unclear specimen count","GSE111889; phs001626.v1.p1; PRJNA398089; mixed adult/pediatric; 2,965 specimens","Nature, GEO, dbGaP, BioProject","updated","Not analysis-ready because assay-specific completeness varies"
"DS002","portal/publication/sample count","Unclear citation and URL","IBDTransDB 2024, DOI/PMID, Shiny portal, 2,932 samples","PMC, PubMed, portal, GitHub","updated","Population set to Unclear because age mix not directly verified"
"DS020","GEO/publication/access","Approximate title and unclear access","GSE134809, Cell 2019 title, DOI, PMID, raw and processed public","GEO, PubMed, DOI","updated","Single-cell Crohn ileal lesion / PBMC context verified"
"DS023","proteomics archive/citation","PRIDE-first and unrestricted public raw data","MassIVE/ProteomeXchange, dataset DOI, Partial Public, related publication noted","ProteomeXchange, MassIVE, PubMed, DOI","partially updated","Publication linkage kept conservative because archive source says no publication"
"DS035","dbGaP title/sample count/access","phs002336, unclear sample count, Blood / Saliva","phs002336.v1.p1, exact dbGaP title, 10,503 subjects, specimen source unclear","dbGaP, DUC PDF, EGA, BioProject","updated","No DS035-specific publication DOI/PMID found"
"2026-05-10","DS003","public-source metadata verification","Verified GEO record, publication, DOI, PMID, RNA-seq platform, and public raw/processed availability. Subject count not directly confirmed from GEO page.","Codex public-source verification"
"2026-05-10","DS004","public-source metadata verification","Verified GEO record, publication, DOI, PMID, sample count, RNA-seq platform, and public raw/processed availability. Age group not directly supported.","Codex public-source verification"
"2026-05-10","DS005","public-source metadata verification","Verified GEO and publication. Corrected platform from microarray to RNA-seq/high-throughput sequencing; public raw and processed data are available.","Codex public-source verification"
"2026-05-10","DS006","public-source metadata verification","Verified GEO record, publication, DOI, PMID, platform, and public raw/processed availability. Subject count remains unclear because samples include internal controls.","Codex public-source verification"
"2026-05-10","DS007","public-source metadata verification","Verified GEO record and publication; 98 children and 176 samples; raw CEL archive and processed data available.","Codex public-source verification"
"2026-05-10","DS008","public-source metadata verification","Verified GEO record, publication, sample count, platform, and public raw/processed availability. Age group not directly supported.","Codex public-source verification"
"2026-05-10","DS009","public-source metadata verification","Verified GEO record and publication. Raw archive is public; processed availability is less clearly stated, so processed_data_available remains Unclear.","Codex public-source verification"
"2026-05-10","DS010","public-source metadata verification","Verified GEO record and publication. GEO indicates 31 individuals/samples and no supplementary raw files; processed data are public.","Codex public-source verification"
"2026-05-10","DS011","public-source metadata verification","Verified GEO and PubMed. GEO design reports 97 UC, 8 CD, and 11 controls with raw and processed public data.","Codex public-source verification"
"2026-05-10","DS012","public-source metadata verification","Verified GEO source record and public data availability. GEO citation is missing and no direct linked PubMed record was confirmed.","Codex public-source verification"
"2026-05-10","DS013","public-source metadata verification","Verified GEO and PubMed. GEO design reports controls, inactive/active UC, and inactive/active CD; subjects left unclear because duplicate batch samples are present.","Codex public-source verification"
"2026-05-10","DS014","public-source metadata verification","Verified GEO and PubMed. Revised tissue site from colon-only to colon plus terminal/neo-ileum based on GEO record.","Codex public-source verification"
"2026-05-10","DS015","public-source metadata verification","Verified GEO and PubMed. GEO design reports 13 UC patients and 8 normal controls.","Codex public-source verification"
"2026-05-10","DS016","public-source metadata verification","Verified GEO and PubMed. Revised disease scope from UC-only to CD, UC, and non-IBD controls based on source record.","Codex public-source verification"
"2026-05-10","DS017","public-source metadata verification","Verified GEO and PubMed. GEO design reports 6 healthy, 6 UC, and 6 CD samples with raw and annotation files.","Codex public-source verification"
"2026-05-10","DS018","public-source metadata verification","Verified GEO and PubMed. GEO design reports 3 healthy, 3 CD, and 3 UC FFPE samples with normalized matrix and raw data.","Codex public-source verification"
"2026-05-10","DS019","public-source metadata verification","Verified GEO and PubMed. PubMed/GEO report 41 subjects and 216 gut biopsies; processed h5 archives are public, raw FASTQ availability was not directly confirmed.","Codex public-source verification"
"2026-05-10","DS021","public-source metadata verification","Verified HCA project, GEO accession, DOI, sample count, access status, and publication. Replaced broad HCA portal description with a specific project-backed row.","Codex public-source verification"
"2026-05-10","DS022","public-source metadata verification","Verified that CELLxGENE hosts relevant public IBD collections, but the row is a portal-level grouping. It should be split into specific collection-backed rows before being treated as a verified dataset.","Codex public-source verification"
"2026-05-10","DS024","public-source metadata verification","Verified ProteomeXchange and publication. ProteomeXchange reports 17 HC, 11 CD, 14 UC, 13 IBS, 8 colon adenoma, and 8 gastric carcinoma samples.","Codex public-source verification"
"2026-05-10","DS025","public-source metadata verification","Verified ProteomeXchange/OmicsDI and primary IBD publication. Source also lists related reuse; primary IBD citation is PMID 25993694.","Codex public-source verification"
"2026-05-10","DS026","public-source metadata verification","Verified MassIVE record and 2022 Microbiome publication that cites MSV000086509. MassIVE marks source as Partial Public.","Codex public-source verification"
"2026-05-10","DS027","public-source metadata verification","Verified Metabolomics Workbench record, publication, DOI, PMID, plasma source, and 89 samples. Subject count not directly supported.","Codex public-source verification"
"2026-05-10","DS028","public-source metadata verification","Verified GEO and PubMed. GEO summary reports 240 newly diagnosed IBD cases and 190 controls, but the series lists 384 raw samples and 382 processed samples.","Codex public-source verification"
"2026-05-10","DS029","public-source metadata verification","Verified GEO and PubMed. GEO reports 17 CD, 11 UC, and 20 normal individuals, including discordant twin sets.","Codex public-source verification"
"2026-05-10","DS030","public-source metadata verification","Verified GEO and PubMed. GEO states 10 CD, 4 UC, and 10 normal individuals, with one UC sample assayed before and after treatment.","Codex public-source verification"
"2026-05-10","DS031","public-source metadata verification","Verified GEO and PubMed. Validation cohort with 5 CD, 5 UC, and 12 normal individuals; one UC sample assayed before and after treatment.","Codex public-source verification"
"2026-05-10","DS032","public-source metadata verification","Verified GEO and PubMed. Revised scope: this is an IBD-relevant epithelial/mechanistic resource using Caco-2 and mouse IEC/crypt methylation data, not a direct human IBD patient cohort.","Codex public-source verification"
"2026-05-10","DS033","public-source metadata verification","Verified public consortium resource and Liu 2015 IIBDGC publication. Tissue/specimen source is not directly supported; sample-level fields remain resource-level or unclear.","Codex public-source verification"
"2026-05-10","DS034","public-source metadata verification","Verified GWAS Catalog trait page as an aggregate summary-statistics resource. One DOI, PMID, and sample size are not applicable to this aggregate row.","Codex public-source verification"
"2026-05-10","DS036","public-source metadata verification","Verified as an open-access integrative genetics resource, not a primary IBD sample-level dataset. Sample-level fields remain not primary or unclear.","Codex public-source verification"
"2026-05-10","DS037","public-source metadata verification","Verified FinnGen and UK Biobank style GWAS resources. This row combines distinct resources and should eventually be split for clean accession, sample-size, and access metadata.","Codex public-source verification"
